{
  "$schema": "https://json-schema.org/draft/2020-12/schema",
  "$id": "https://example.invalid/schemas/operational-evidence-index.schema.json",
  "title": "OperationalEvidenceIndex",
  "type": "object",
  "additionalProperties": false,
  "required": [
    "schemaVersion",
    "profileId",
    "expiresAt",
    "issuedAt",
    "sequence",
    "releaseSubject",
    "trustedTimeAttestationPath",
    "records",
    "indexSignature",
    "currentPackageDeclaration"
  ],
  "properties": {
    "schemaVersion": {
      "const": "1.0"
    },
    "profileId": {
      "type": "string",
      "pattern": "^[A-Z0-9_]{8,96}$"
    },
    "releaseSubject": {
      "type": "object",
      "additionalProperties": false,
      "required": [
        "releaseId",
        "environment",
        "sourceCommit",
        "sourceTreeSha256",
        "androidArtifactSha256",
        "iosArtifactSha256",
        "backendImageDigest",
        "signerImageDigest",
        "configurationBundleSha256",
        "policyBundleSha256",
        "assetRegistrySha256",
        "sbomSha256"
      ],
      "properties": {
        "releaseId": {
          "type": "string",
          "minLength": 1,
          "maxLength": 160
        },
        "environment": {
          "enum": [
            "DESIGN_ONLY",
            "STAGING",
            "TESTNET",
            "PRODUCTION"
          ]
        },
        "sourceCommit": {
          "type": [
            "string",
            "null"
          ],
          "pattern": "^[0-9a-f]{40,64}$"
        },
        "sourceTreeSha256": {
          "type": [
            "string",
            "null"
          ],
          "pattern": "^[0-9a-f]{64}$"
        },
        "androidArtifactSha256": {
          "type": [
            "string",
            "null"
          ],
          "pattern": "^[0-9a-f]{64}$"
        },
        "iosArtifactSha256": {
          "type": [
            "string",
            "null"
          ],
          "pattern": "^[0-9a-f]{64}$"
        },
        "backendImageDigest": {
          "type": [
            "string",
            "null"
          ],
          "pattern": "^sha256:[0-9a-f]{64}$"
        },
        "signerImageDigest": {
          "type": [
            "string",
            "null"
          ],
          "pattern": "^sha256:[0-9a-f]{64}$"
        },
        "configurationBundleSha256": {
          "type": [
            "string",
            "null"
          ],
          "pattern": "^[0-9a-f]{64}$"
        },
        "policyBundleSha256": {
          "type": [
            "string",
            "null"
          ],
          "pattern": "^[0-9a-f]{64}$"
        },
        "assetRegistrySha256": {
          "type": [
            "string",
            "null"
          ],
          "pattern": "^[0-9a-f]{64}$"
        },
        "sbomSha256": {
          "type": [
            "string",
            "null"
          ],
          "pattern": "^[0-9a-f]{64}$"
        }
      }
    },
    "trustedTimeAttestationPath": {
      "type": [
        "string",
        "null"
      ],
      "pattern": "^delivery/evidence/artifacts/[A-Za-z0-9._/-]+\\.json$"
    },
    "records": {
      "type": "array",
      "items": {
        "type": "object",
        "additionalProperties": false,
        "required": [
          "gateId",
          "claimId",
          "statementPath",
          "statementSha256",
          "approvalArtifacts"
        ],
        "properties": {
          "gateId": {
            "type": "string",
            "pattern": "^[A-Z][A-Z0-9_]{2,63}$"
          },
          "claimId": {
            "type": "string",
            "pattern": "^[A-Z][A-Z0-9_]{2,95}$"
          },
          "statementPath": {
            "type": "string",
            "pattern": "^delivery/evidence/artifacts/[A-Za-z0-9._/-]+\\.json$"
          },
          "statementSha256": {
            "type": "string",
            "pattern": "^[0-9a-f]{64}$"
          },
          "approvalArtifacts": {
            "type": "array",
            "items": {
              "type": "object",
              "additionalProperties": false,
              "required": [
                "path",
                "sha256"
              ],
              "properties": {
                "path": {
                  "type": "string",
                  "pattern": "^delivery/evidence/artifacts/[A-Za-z0-9._/-]+\\.json$"
                },
                "sha256": {
                  "type": "string",
                  "pattern": "^[0-9a-f]{64}$"
                }
              }
            }
          }
        }
      }
    },
    "indexSignature": {
      "anyOf": [
        {
          "type": "object",
          "additionalProperties": false,
          "required": [
            "profile",
            "keyId",
            "signatureBase64"
          ],
          "properties": {
            "profile": {
              "const": "ONE_INTENT_ED25519_CANONICAL_JSON_V2"
            },
            "keyId": {
              "type": "string",
              "minLength": 1,
              "maxLength": 128
            },
            "signatureBase64": {
              "type": "string",
              "minLength": 4,
              "maxLength": 256
            }
          }
        },
        {
          "type": "null"
        }
      ]
    },
    "currentPackageDeclaration": {
      "type": "string",
      "minLength": 20,
      "maxLength": 500
    },
    "sequence": {
      "type": "integer",
      "minimum": 0
    },
    "issuedAt": {
      "type": "string",
      "format": "date-time",
      "pattern": "^\\d{4}-\\d{2}-\\d{2}T\\d{2}:\\d{2}:\\d{2}Z$"
    },
    "expiresAt": {
      "type": "string",
      "format": "date-time",
      "pattern": "^\\d{4}-\\d{2}-\\d{2}T\\d{2}:\\d{2}:\\d{2}Z$"
    }
  }
}
